ID,Date / Time,Country,City,State,Shape,Summary,lat,lng,Date,Time
154,12/02/2016 22:00,USA,Philadelphia,PA,Light,Lights in the sky in Philly!!! ((NUFORC Note: Advertising lights. PD)),39.9523993,-75.1635898,12/02/2016,22:00
548,11/05/2016 17:15,USA,Philadelphia,PA,Other,"4 Bright White Cigar/Long Disc Shape - Traveling Slanted in sky - 
Dissapeared & Reappeared 3 jets chasing them -Witnessed by 2 in car",39.9523993,-75.1635898,11/05/2016,17:15
719,10/22/16 23:38,USA,Philadelphia,PA,Other,"Using my binoculars I witnessed a cigar shaped, rusty orange colored object 
fly from my south to east .",39.9523993,-75.1635898,10/22/16,23:38
842,10/15/16 23:15,USA,Philadelphia,PA,Sphere,"A single orange light traveled in a slow, erratic, yet seemingly controlled 
pattern across the sky.",39.9523993,-75.1635898,10/15/16,23:15
1183,9/24/16 19:30,USA,Philadelphia,PA,Light,"Outside about 7;30 pm on sat 9/24/16 cleaning and doing maintenance work at 
my auto repair shop in phila when I look up, its now dusk,",39.9523993,-75.1635898,09/24/16,19:30
1733,8/22/16 22:26,USA,Philadelphia,PA,Light,"Flash of light falls from sky and disappears when it hits the ground. 
((anonymous report))",39.9523993,-75.1635898,08/22/16,22:26
2743,07/01/2016 19:30,USA,Philadelphia,PA,Light,Bright white light disappears against bright blue sky,39.9523993,-75.1635898,07/01/2016,19:30
3101,06/03/2016 22:30,USA,Philadelphia,PA,Light,Bright red/orange non pulsing lights observed over metropolitan area.,39.9523993,-75.1635898,06/03/2016,22:30
3422,05/07/2016 21:00,USA,Philadelphia,MS,Fireball,"Wife and I were on Hwy 15 North 5-7 mi. outside of Philadelphia, MS, when 
we noticed a hovering group of 5-7 fireballs.",32.7703841,-89.1153487,05/07/2016,21:00
3475,05/03/2016 20:39,USA,Philadelphia,PA,Circle,"Round, white, lights in night sky above Philadelphia, PA, May 3, 2016.",39.9523993,-75.1635898,05/03/2016,20:39
3496,4/30/16 22:00,USA,Philadelphia,PA,Light,"Barbecuing on the deck Saturday night and was shocked seeing red flair like 
objects traveling at about 30 mph in no certain formation.",39.9523993,-75.1635898,04/30/16,22:00
3497,4/30/16 21:30,USA,Philadelphia,PA,Fireball,Orange orbs in groups of four or five flying in triangle or line.,39.9523993,-75.1635898,04/30/16,21:30
3958,3/22/16 21:29,USA,Philadelphia,PA,Other,Bright white object by Phila Airport High Up Across Sky,39.9523993,-75.1635898,03/22/16,21:29
4386,2/17/16 22:30,USA,Philadelphia,PA,Light,"4 orange lights seen moving W to E over Philadelphia. Two lights moving 
together at some distance suddenly got close to each othe",39.9523993,-75.1635898,02/17/16,22:30
4421,2/15/16 09:30,USA,Philadelphia,PA,Other,"((HOAX??)) One or two bright green circles flashing darted through the sky, 
it scared the hell out of me. I live in the NW Phila..",39.9523993,-75.1635898,02/15/16,09:30
4646,1/31/16 20:00,USA,Philadelphia,PA,Other,"Eight fire ball shapes flying west , north, and straight up, but calm 
manner. They were focused.",39.9523993,-75.1635898,01/31/16,20:00
4836,1/14/16 14:45,USA,Philadelphia,PA,Other,"Flashing red/ green light, circling in sky. NE Philly. ((NUFORC Note: We 
suspect the time is wrong, but will check. PD))",39.9523993,-75.1635898,01/14/16,14:45
4930,01/05/2016 22:40,USA,Philadelphia,PA,Other,"Dark half oval flying over house, then disappearing into the dark sky.",39.9523993,-75.1635898,01/05/2016,22:40
8,12/19/16 19:02,USA,Phoenix,AZ,Circle,"Bright light in the night sky. Disappears within about every 30 min returns 
in intervals. ((NUFORC Note: Venus?? PD))",33.4485866,-112.0773455,12/19/16,19:02
95,12/09/2016 22:00,USA,Phoenix,AZ,Other,"We were looking towards east and seen in the sky a object that was spinning 
or lights were spinning. ((NUFORC Note: Star? PD))",33.4485866,-112.0773455,12/09/2016,22:00
360,11/15/16 20:00,USA,Phoenix,AZ,Other,"2 fast low flying planes follow point of light in sky over east valley in 
Phoenix",33.4485866,-112.0773455,11/15/16,20:00
428,11/11/2016 18:45,USA,Phoenix,AZ,Light,Light follows Southwest Airlines flight for 60 minutes.,33.4485866,-112.0773455,11/11/2016,18:45
456,11/10/2016 19:15,USA,Phoenix,AZ,Other,"White/orange circular lights in rectangle formation Phoenix, Arizona.",33.4485866,-112.0773455,11/10/2016,19:15
458,11/10/2016 19:00,USA,Phoenix,AZ,Circle,3 lights in formation turning off and on in sequence.,33.4485866,-112.0773455,11/10/2016,19:00
742,10/21/16 23:50,USA,Phoenix,AZ,Other,Mysterious object in the Phoenix sky.,33.4485866,-112.0773455,10/21/16,23:50
1048,10/01/2016 19:30,USA,Phoenix,AZ,Other,"7 objects appearing to be fire going over phoenix az sky at around 730 pm 
on oct.1 2016",33.4485866,-112.0773455,10/01/2016,19:30
1915,08/12/2016 02:04,USA,Phoenix,AZ,Light,"Went out to smoke a cigarette and saw a flash of blue light in the sky, it 
was like something just warped out. The blue light was compo",33.4485866,-112.0773455,08/12/2016,02:04
2084,08/02/2016 19:25,USA,Phoenix,AZ,Light,This was not a plane or helecopter.,33.4485866,-112.0773455,08/02/2016,19:25
2120,7/31/16 20:00,USA,Phoenix,AZ,Other,"Looks like square lightning. ((NUFORC Note: Looks like a normal lightning 
bolt to us. PD))",33.4485866,-112.0773455,07/31/16,20:00
2173,7/28/16 09:00,USA,Phoenix,AZ,Other,"Faster than Mach 9.6 or almost 7,000 mph. WAY FASTER!",33.4485866,-112.0773455,07/28/16,09:00
2384,7/21/16 22:00,USA,Phoenix,AZ,Circle,"OBJECT CROSSED THE SKY SO FAST, LIKE IT WAS HURLING TOWARD THE GROUND, BUT 
DISAPPEARED INSTEAD.",33.4485866,-112.0773455,07/21/16,22:00
2410,7/19/16 00:10,USA,Phoenix,AZ,Other,"Strange red lights in Phoenix Sky, just now.",33.4485866,-112.0773455,07/19/16,00:10
2726,07/02/2016 21:03,USA,Phoenix,AZ,Light,"3 Moving Lights with Large Trails in Phoenix form a Triangle in the Night 
Sky",33.4485866,-112.0773455,07/02/2016,21:03
2781,6/29/16 01:01,USA,Phoenix,AZ,Light,"Please review the show of ""American Monster"" S1 / E5 ""Shooting Phoenix."" 
This show has absolutely nothing to do w/ UFOs.",33.4485866,-112.0773455,06/29/16,01:01
2806,6/27/16 17:50,USA,Phoenix,AZ,Other,"Oval shaped disk w/15 degree increase towards center top; bright light 
w/thin beams extended to its side; shot up & disappeared.",33.4485866,-112.0773455,06/27/16,17:50
2965,6/13/16 22:30,USA,Phoenix,AZ,Circle,"Bright circular light over North Phoenix, then disappears.",33.4485866,-112.0773455,06/13/16,22:30
2968,6/13/16 02:00,USA,Phoenix,AZ,Circle,Bright white/blue halo over Phoenix.,33.4485866,-112.0773455,06/13/16,02:00
2970,06/12/2016 23:30,USA,Phoenix,AZ,Light,"Late night, on a mountain relatively close to my home, I encountered this 
green light streak across the sky. Heading in the north-west",33.4485866,-112.0773455,06/12/2016,23:30
3123,06/02/2016 04:00,USA,Phoenix,AZ,Other,It turned the Phoenix area in to full daylight....,33.4485866,-112.0773455,06/02/2016,04:00
3124,06/02/2016 04:00,USA,Phoenix,AZ,Fireball,"Gigantic fireball lit up the night sky just like it was daylight. E sky, N 
Phoenix. Huge contrail was left in the sky. ((meteor??))",33.4485866,-112.0773455,06/02/2016,04:00
3127,06/02/2016 03:55,USA,Phoenix,AZ,Other,"Bright light swell, north of Phoenix.",33.4485866,-112.0773455,06/02/2016,03:55
3154,5/30/16 21:00,USA,Phoenix,AZ,Other,"Monday May 30th NE Phoenix, 7th Street and Paradise LN.",33.4485866,-112.0773455,05/30/16,21:00
3213,5/27/16 22:00,USA,Phoenix,AZ,Other,"Friday the 27th of May at 10pm noticed a light flashing in the sky NE of 
Phoenix",33.4485866,-112.0773455,05/27/16,22:00
3478,05/03/2016 12:00,USA,Phoenix,AZ,Other,"05/03/2016 UFOS OVER PHOENIX SKYHABOR AIRPORT 1. BRIGHT LIGHTS Small bright 
lights dancing all over skyhabor airport 12pm A. Disk shap",33.4485866,-112.0773455,05/03/2016,12:00
3564,4/23/16 23:00,USA,Phoenix,AZ,Light,"I was going into my home i noticed a fire in the sky looked like a big 
shooting star i immediately started recording i told my boyfrien",33.4485866,-112.0773455,04/23/16,23:00
3573,4/23/16 21:20,USA,Phoenix,AZ,Light,Bright light. ((NUFORC Note: Possible flare from an Iridium satellite? PD)),33.4485866,-112.0773455,04/23/16,21:20
3864,3/30/16 23:00,USA,Phoenix,AZ,Other,Strange light or object in North Phoenix sky,33.4485866,-112.0773455,03/30/16,23:00
4048,3/15/16 02:40,USA,Phoenix,AZ,Other,"((HOAX??)) It was semi transparent shaped like a bomarang but the right 
side was a little shorter. size of a small 727, silent.",33.4485866,-112.0773455,03/15/16,02:40
4205,03/02/2016 20:00,USA,Phoenix,AZ,Other,4 objects with one red and green light on each hovering over the freeway.,33.4485866,-112.0773455,03/02/2016,20:00
4206,03/02/2016 19:41,USA,Phoenix,AZ,Light,"UP DATE ON 3-2-16 REPORT OF 3 BRIGHT LIGHT'S FOLLOWED BY RED LIGHT MAKING 
LOUD HELICOPTER LIKE NOISE.",33.4485866,-112.0773455,03/02/2016,19:41
4207,03/02/2016 19:41,USA,Phoenix,AZ,Light,"3 Blue-whites Being Followed,By Red Blinking Light Making Loud 
Helicopter-Like Noise!,.",33.4485866,-112.0773455,03/02/2016,19:41
4254,2/29/16 01:00,USA,Phoenix,AZ,Circle,"UFO sighting over Phoenix, AZ 02/29/16",33.4485866,-112.0773455,02/29/16,01:00
4373,2/19/16 18:38,USA,Phoenix,AZ,Other,"At first sight, we thought...the Phoenix Lights are back!!!",33.4485866,-112.0773455,02/19/16,18:38
4453,2/13/16 14:30,USA,Phoenix,AZ,Circle,High altitude white disc observed.,33.4485866,-112.0773455,02/13/16,14:30
4686,1/28/16 21:30,USA,Phoenix,AZ,Circle,4 bright circular lights in sky over South Phoenix.,33.4485866,-112.0773455,01/28/16,21:30
4691,1/28/16 19:30,USA,Phoenix,AZ,Light,Multiple lights hovering in a row North of Phoenix!,33.4485866,-112.0773455,01/28/16,19:30
4701,1/27/16 20:15,USA,Phoenix,AZ,Light,6 bright red lights ascending form horizon in the western sky.,33.4485866,-112.0773455,01/27/16,20:15
4764,1/21/16 22:00,USA,Phoenix,AZ,Other,HUGE BLUISH AND PURPLE DISK-LIKE SAUCER HOOVERING ABOVE THE CANYON SKYLINE,33.4485866,-112.0773455,01/21/16,22:00
4853,1/13/16 16:20,USA,Phoenix,AZ,Other,Sighting of small white orbs high over Phoenix.,33.4485866,-112.0773455,01/13/16,16:20
4979,01/02/2016 19:15,USA,Phoenix,AZ,Other,"At about 19:15 hrs. this evening, walking dog, noticed 2 bright red objects 
in W sky heading W; one was following the other.",33.4485866,-112.0773455,01/02/2016,19:15
5000,01/01/2016 12:00,USA,Phoenix,AZ,Light,"White, round, object in sky, zigzag. Phoenix, AZ.",33.4485866,-112.0773455,01/01/2016,12:00
23,12/17/16 20:00,USA,San Diego,CA,Sphere,"Was standing on top of Sunset Cliffs overlooking the Pacific ocean. I 
noticed a dim red light around near where the horizon should hav",32.7174209,-117.1627713,12/17/16,20:00
49,12/14/16 09:00,USA,San Diego,CA,Other,"Angel, protector.",32.7174209,-117.1627713,12/14/16,09:00
267,11/22/16 05:20,USA,San Diego,CA,Sphere,"It was a white glowing sphere. It was traveling from West to north east. I 
lost track of what happened next, it disappeared from sky. C",32.7174209,-117.1627713,11/22/16,05:20
641,10/29/16 19:10,USA,San Diego,CA,Light,"Light beam witnessed above Mission Bay/Pacific Beach San Diego. ((anonymous 
report))",32.7174209,-117.1627713,10/29/16,19:10
896,10/11/2016 19:25,USA,San Diego,CA,Light,"Orange light crossed the sky like a fast satellite and then dropped down at 
a sharp angle backwards and disappeared.",32.7174209,-117.1627713,10/11/2016,19:25
897,10/11/2016 19:25,USA,San Diego,CA,Light,"An orange light moved into the glow of the moon and came back out, 
brighter, shooting diagonally down.",32.7174209,-117.1627713,10/11/2016,19:25
1270,9/19/16 03:32,USA,San Diego,CA,Triangle,"San Diego, CA 9/19/16 3:32 am I heard noise like a thunder clap and what 
sounded to be a low flying roar from an aircraft. I walked ou",32.7174209,-117.1627713,09/19/16,03:32
1765,8/20/16 22:50,USA,San Diego,CA,Circle,"My wife and I both saw three orange lights in the sky, moving in different 
directions, and making no sound.",32.7174209,-117.1627713,08/20/16,22:50
1848,8/15/16 21:36,USA,San Diego,CA,Fireball,"Flashing fireball slowly moving over Mission Valley around 9:36 pm on 
Monday night 8/15/2016. Looked like the flash of fire wold repeat",32.7174209,-117.1627713,08/15/16,21:36
2249,7/27/16 21:35,USA,San Diego,CA,Light,Looking north from Point Loma in San Diego ((NUFORC Note: Space debris. PD)),32.7174209,-117.1627713,07/27/16,21:35
2475,7/15/16 04:45,USA,San Diego,CA,Triangle,Triangular UFO. ((anonymous report)),32.7174209,-117.1627713,07/15/16,04:45
3267,5/21/16 21:45,USA,San Diego,CA,Other,"Formation of 12 steady white lights floats from west to east, slowly 
ascending, over Mission Valley, San Diego.",32.7174209,-117.1627713,05/21/16,21:45
3500,4/30/16 04:00,USA,San Diego,CA,Light,"4 short 5 second bursts of light in the clouds, each spread out 15 seconds 
apart. ((anonymous report))",32.7174209,-117.1627713,04/30/16,04:00
3539,4/26/16 20:25,USA,San Diego,CA,Triangle,"Triangular delta shaped object, large and silent moved nnw from coronado 
over lindbergh and continuing nnw. ((anonymous source))",32.7174209,-117.1627713,04/26/16,20:25
3825,04/02/2016 13:45,USA,San Diego,CA,Other,"UFO Fleet Observed Passing Over Tecolote Shores Park Near Mission Bay, San 
Diego.",32.7174209,-117.1627713,04/02/2016,13:45
3859,3/31/16 04:00,USA,San Diego,CA,Other,Many bright rotations of Other air crafts.,32.7174209,-117.1627713,03/31/16,04:00
4479,02/11/2016 06:42,USA,San Diego,CA,Other,Pink and green flash and disappeared.,32.7174209,-117.1627713,02/11/2016,06:42
4482,02/11/2016 06:40,USA,San Diego,CA,Light,Blue light streaks across San Diego sky.,32.7174209,-117.1627713,02/11/2016,06:40
4722,1/25/16 05:45,USA,San Diego,CA,Sphere,"Steady light traveling at a high velocity across the southern dark morning 
sky.",32.7174209,-117.1627713,01/25/16,05:45
4934,01/05/2016 21:18,USA,San Diego,CA,Light,"I was sitting on my front porch when I witnessed two objects flying from 
south to north at an apparent high rate of speed at about 50-5",32.7174209,-117.1627713,01/05/2016,21:18
4944,01/04/2016 21:20,USA,San Diego,CA,Triangle,"Driving home from class, looked up, and saw the orangish reddish lights 
flyung slow and lower than a plane would. Then the three lights",32.7174209,-117.1627713,01/04/2016,21:20
66,12/12/2016 20:45,USA,Jacksonville,FL,Light,"Looking in the east night sky, two airplanes where flying in an echelon 
formation, approximately 10,000 feet. Appearing between the two",30.3321838,-81.6556509,12/12/2016,20:45
378,11/14/16 19:17,USA,Jacksonville,FL,Light,Bright Light in Clear Sky.,30.3321838,-81.6556509,11/14/16,19:17
729,10/22/16 20:00,USA,Jacksonville,FL,Light,"For 2 weeks, a bright star-like light appears in SW sky every night around 
dusk, then disappears.",30.3321838,-81.6556509,10/22/16,20:00
814,10/17/16 22:00,USA,Jacksonville,AR,Light,"Saw small craft with white, blue, and red blinking lights hovering in one 
area then saw a triangle craft with light sound fly from mili",34.8662005,-92.1101457,10/17/16,22:00
831,10/17/16 05:35,USA,Jacksonville,FL,Other,Blue light hovering then zoomed away.,30.3321838,-81.6556509,10/17/16,05:35
1644,8/29/16 20:45,USA,Jacksonville,FL,Sphere,"5 orange-yellow lights near I-295 E of Buckman Bridge, moving slowly 
vertically and horizontally.",30.3321838,-81.6556509,08/29/16,20:45
1874,8/13/16 22:15,USA,Jacksonville,FL,Light,"My girlfriend noticed a bright star over one of the trees and pointed it 
out to me.",30.3321838,-81.6556509,08/13/16,22:15
2000,08/08/2016 11:16,USA,Jacksonville,FL,Light,At least 20 different colored shining objects in the sky that are moving.,30.3321838,-81.6556509,08/08/2016,11:16
2107,08/01/2016 20:45,USA,Jacksonville,FL,Other,"Three bright reds lights crossing the sky, and then straight up and out of 
sight.",30.3321838,-81.6556509,08/01/2016,20:45
2108,08/01/2016 20:45,USA,Jacksonville,FL,Light,"Red lights, three, moving from east to west, the stright up.",30.3321838,-81.6556509,08/01/2016,20:45
2680,07/03/2016 23:00,USA,Jacksonville,FL,Circle,"A floating ball of light that zig-zag's at light speed leaving a light 
trail.",30.3321838,-81.6556509,07/03/2016,23:00
2857,6/23/16 00:31,USA,Jacksonville,FL,Other,"A fast-moving, pentagon-shaped object rapidly transiting across the 
norhtern face of the moon.",30.3321838,-81.6556509,06/23/16,00:31
3187,5/29/16 00:30,USA,Jacksonville,FL,Triangle,"While stargazing, an ultra fast moving, glowing (white/yellow) object 
appeared in a clear, cloudless sky. ((anonymous report))",30.3321838,-81.6556509,05/29/16,00:30
3365,5/13/16 21:30,USA,Jacksonville,FL,Triangle,Large triangle craft.,30.3321838,-81.6556509,05/13/16,21:30
3485,05/01/2016 22:30,USA,Jacksonville,FL,Other,"Free floating Orbs above Sunbeam Road in Duval County, Florida. I watch 
sober.",30.3321838,-81.6556509,05/01/2016,22:30
3567,4/23/16 22:30,USA,Jacksonville,FL,Other,Orange 5 ufo formation.,30.3321838,-81.6556509,04/23/16,22:30
3644,4/17/16 20:22,USA,Jacksonville,FL,Light,"Light looks like satellite little biger, cover 50 grades of azimuth in 1 
second, A=0 grades, H=56 approach, solid light. ((anonymous))",30.3321838,-81.6556509,04/17/16,20:22
3684,4/14/16 22:58,USA,Jacksonville,FL,Triangle,"I was sitting on bench in front of my place and looked up and saw a 
triangular shaped craft moving very fast. Then it stopped for a min",30.3321838,-81.6556509,04/14/16,22:58
3950,3/23/16 21:10,USA,Jacksonville,FL,Fireball,Fireball chased by jets.,30.3321838,-81.6556509,03/23/16,21:10
4197,03/02/2016 22:50,USA,Jacksonville,OH,Triangle,2 side-by-side green lights moving super fast and were super loud.,40.3722906,-80.6114625,03/02/2016,22:50
4310,2/25/16 00:00,USA,Jacksonville,FL,Circle,"((HOAX??)) I stepped outside during night hours and look up to the sky, 
because I'm a skeptic. Started seeing these odd white lights.",30.3321838,-81.6556509,02/25/16,00:00
96,12/09/2016 21:50,USA,Portland,OR,Other,Pulsing green light over Portland.,45.5202471,-122.6741948,12/09/2016,21:50
161,12/01/2016 19:45,USA,Portland,TN,Light,2 brilliant lights.,36.5817089,-86.5163832,12/01/2016,19:45
361,11/15/16 19:10,USA,Portland,OR,Triangle,"Transparent and shimmering, triangular, completely silent, travelling N to 
S 20 yards above rooftops, three jets followed.",45.5202471,-122.6741948,11/15/16,19:10
371,11/15/16 03:29,USA,Portland,OR,Other,"Hovering oval object in Portland, Oregon.",45.5202471,-122.6741948,11/15/16,03:29
511,11/07/2016 10:30,USA,Portland,OR,Other,Color shifting object moving east to west mid-morning.,45.5202471,-122.6741948,11/07/2016,10:30
1207,9/22/16 20:45,USA,Portland,OR,Sphere,Slow moving orb over Portland oregon,45.5202471,-122.6741948,09/22/16,20:45
1545,09/03/2016 23:55,USA,Portland,OR,Fireball,"At approx 11:55 pm, I observed in the western sky a large green fireball, 
with a strange oblong shape to it, traveling northward, at a",45.5202471,-122.6741948,09/03/2016,23:55
1646,8/29/16 20:25,USA,Portland,OR,Sphere,"These spheres are white like electic and appear about 8:25 pm for weeks now 
they stay stationary for up to 4 to 5 minutes than descend",45.5202471,-122.6741948,08/29/16,20:25
1893,08/12/2016 22:30,USA,Portland,OR,Light,Satellite not what it appears to be.,45.5202471,-122.6741948,08/12/2016,22:30
1978,08/09/2016 23:00,USA,Portland,OR,Other,"Orbiting object flares, separate flash appears, then object disappears.",45.5202471,-122.6741948,08/09/2016,23:00
2086,08/02/2016 11:15,USA,Portland,OR,Light,"Sitting on my porch with my significant other and saw a light appear from 
the sky and come down stay for a second and then go back up t",45.5202471,-122.6741948,08/02/2016,11:15
2326,7/24/16 15:00,USA,Portland,OR,Other,Dark grey box floating in the air near PDX airport.,45.5202471,-122.6741948,07/24/16,15:00
2481,7/14/16 21:30,USA,Portland,OR,Other,Fireball.,45.5202471,-122.6741948,07/14/16,21:30
2843,6/24/16 15:30,USA,Portland,ME,Other,Cylindrical object disappeared in clear skies.,43.6610277,-70.2548595,06/24/16,15:30
3096,06/03/2016 23:50,USA,Portland,OR,Circle,"((HOAX?? DATE IS FLAWED)) Faster then anything I've ever seen ((anonymous 
report))",45.5202471,-122.6741948,06/03/2016,23:50
3119,06/02/2016 22:45,USA,Portland,OR,Triangle,"3 bright dots and 3 bright lines nearly connecting them-outlining a perfect 
triangle floating still and bright, high in the S sky.",45.5202471,-122.6741948,06/02/2016,22:45
3328,5/15/16 22:53,USA,Portland,OR,Other,"Huge oval object with flashing colored lights and buzzing noise appeared 
outside my house.",45.5202471,-122.6741948,05/15/16,22:53
3357,5/14/16 00:00,USA,Portland,OR,Other,"Large flashes of light in N.E, Portland.",45.5202471,-122.6741948,05/14/16,00:00
3426,05/07/2016 10:00,USA,Portland,OR,Other,"((HOAX??)) Crafts flying over Portland. Orange light from bottom. Seemed to 
be two, one higher than the other. ((anonymous report))",45.5202471,-122.6741948,05/07/2016,10:00
3738,04/09/2016 22:30,USA,Portland,OR,Sphere,"6-10 slow moving, orange orbs or spheres",45.5202471,-122.6741948,04/09/2016,22:30
3755,04/08/2016 21:45,USA,Portland,OR,Circle,Slow moving orange lights.,45.5202471,-122.6741948,04/08/2016,21:45
3814,04/02/2016 22:19,USA,Portland,OR,Other,"Glowing orange object (like a burning plane) disappears/fades away, doesn't 
fall to earth.",45.5202471,-122.6741948,04/02/2016,22:19
3835,04/01/2016 20:55,USA,Portland,OR,Light,Multiple sightings of bright white orbs that sometimes flashed brightly.,45.5202471,-122.6741948,04/01/2016,20:55
3842,04/01/2016 19:58,USA,Portland,OR,Other,"I was standing in my backyard when I saw 3 dark objects in a triangle shape 
heading in a southerly direction.",45.5202471,-122.6741948,04/01/2016,19:58
3843,04/01/2016 19:58,USA,Portland,OR,Other,"I saw what look like 3 objects at a very high altitude flying in a 
southeasterly direction. There was no sound and no lights. They mov",45.5202471,-122.6741948,04/01/2016,19:58
3861,3/31/16 02:00,USA,Portland,OR,Light,"Went on a bike ride with my headphones in, was almost home i looked left 
casually and looked in the sky. I saw a VERY WHITE bright ligh",45.5202471,-122.6741948,03/31/16,02:00
4059,3/14/16 02:30,USA,Portland,OR,Other,While standing in my back yard I was watching the dark clouds coming in.,45.5202471,-122.6741948,03/14/16,02:30
4692,1/28/16 19:00,USA,Portland,OR,Circle,"Saw three orange circles near each other and then they spread apart but 
weren't definitely airplanes or stars. They were slowly moving.",45.5202471,-122.6741948,01/28/16,19:00
112,12/07/2016 18:53,USA,Las Vegas,NV,Other,"Pyramid or triangle or similar shape.. maybe rotating silent floating over 
us 95 and Decatur, going south.. south east.",36.1662859,-115.1492249,12/07/2016,18:53
518,11/06/2016 20:15,USA,Las Vegas,NV,Circle,Dancing orbs.,36.1662859,-115.1492249,11/06/2016,20:15
1072,9/30/16 15:30,USA,Las Vegas,NV,Other,"((NUFORC Note: No information provided by source, who elects to remain 
anonymous. PD))",36.1662859,-115.1492249,09/30/16,15:30
1202,9/23/16 17:30,USA,Las Vegas,NV,Other,Strange Lights over Frenchman Mountain Range in Las Vegas.,36.1662859,-115.1492249,09/23/16,17:30
1271,9/18/16 23:00,USA,Las Vegas,NV,Other,"Object moved south west from miserable Airport passing over mountain near 
German high school passing three aircraft moving East to west",36.1662859,-115.1492249,09/18/16,23:00
2002,08/08/2016 08:00,USA,Las Vegas,NV,Triangle,"Object observed from flight from Las Vegas to Vancouver. ((NUFORC Note: 
Nice photo of approaching B2 bomber. PD))",36.1662859,-115.1492249,08/08/2016,08:00
2081,08/02/2016 22:00,USA,Las Vegas,NV,Light,Flashing/pulsing green light in northwest vegas sky.,36.1662859,-115.1492249,08/02/2016,22:00
2279,7/27/16 06:00,USA,Las Vegas,NV,Light,"At around 6:00 pm, I was on my balcony in central Las Vegas. I saw a light 
traveling east to west, go into a cloud, then come out to th",36.1662859,-115.1492249,07/27/16,06:00
2370,7/22/16 02:45,USA,Las Vegas,NV,Light,"Bright white light streak, traveling at a extremely high rate of speed. 
Vanished into thin air. ((anonymous report))",36.1662859,-115.1492249,07/22/16,02:45
2488,7/13/16 23:34,USA,Las Vegas,NV,Triangle,"On the night of Wednesday the 13th of July 2016, I was outside taking my 
dog out to use the restroom. When I noticed some electrical in",36.1662859,-115.1492249,07/13/16,23:34
2839,6/25/16 00:45,USA,Las Vegas,NV,Other,"Brief brilliant flash of light in the SW sky in Vegas. Like a light burning 
out.",36.1662859,-115.1492249,06/25/16,00:45
2964,6/13/16 23:45,USA,Las Vegas,NV,Light,light lightspeed vanished. ((anonymous report)),36.1662859,-115.1492249,06/13/16,23:45
3090,06/04/2016 20:30,USA,Las Vegas,NV,Light,"Round, white, non-blinking light traveling from the SW to the NW.",36.1662859,-115.1492249,06/04/2016,20:30
3129,06/02/2016 03:55,USA,Las Vegas,NV,Fireball,"Large fireball with long tail traveling north to south s.e. of Vegas. 
((NUFORC Note: Reported to have been a meteor. PD))",36.1662859,-115.1492249,06/02/2016,03:55
3132,06/01/2016 22:45,USA,Las Vegas,NV,Other,"Spaceship like something we could make soon, very basic",36.1662859,-115.1492249,06/01/2016,22:45
3464,05/04/2016 21:00,USA,Las Vegas,NV,Other,"I was outside with my dog I always look up in the sky at night I saw what 
looked like a planet size but it was blue,i kept looking at",36.1662859,-115.1492249,05/04/2016,21:00
3808,04/02/2016 22:55,USA,Las Vegas,NV,Triangle,"Triangle shaped object hovering in sky colors red, white, green and blue 
with a tail. 10 minutes hovered before moving slowly",36.1662859,-115.1492249,04/02/2016,22:55
4176,03/04/2016 19:09,USA,Las Vegas,NV,Other,"Was out in front of the house and I looked up and I seen this bright white 
egg like shape going though the clouds and it was going at a",36.1662859,-115.1492249,03/04/2016,19:09
