ID,Date / Time,Country,City,State,Shape,Summary,lat,lng,Date,Time
4230,03/01/2016 05:57,USA,Las Vegas,NV,Fireball,"Driving down Decatur Sahara. Right in front of my driving view I notice a 
blue and orange flying fireball. Coming from Charleston towar",36.1662859,-115.1492249,03/01/2016,05:57
4778,1/20/16 17:20,USA,Las Vegas,NV,Other,"Blinking red, green and blue lights. ((NUFORC Note: Possibly a ""twinkling"" 
star?? PD))",36.1662859,-115.1492249,01/20/16,17:20
4901,01/08/2016 02:23,USA,Las Vegas,NV,Light,Green blinking light in the sky.,36.1662859,-115.1492249,01/08/2016,02:23
4932,01/05/2016 21:35,USA,Las Vegas,NV,Triangle,"Driving on 95S, saw a triangle with an inverted bottom, outlined in chasing 
white lights. ((NUFORC Note: Former law enforcement. PD))",36.1662859,-115.1492249,01/05/2016,21:35
5011,01/01/2016 00:15,USA,Las Vegas,NV,Other,"Red orbs after the New Year's eve celebration. Flying over the Las Vegas 
Valley.",36.1662859,-115.1492249,01/01/2016,00:15
5017,01/01/2016 00:05,USA,Las Vegas,NV,Light,"My wife and I witnessed 3 bright red objects that rose one behind the other 
shortly after midnight.",36.1662859,-115.1492249,01/01/2016,00:05
177,11/29/16 22:15,USA,Colorado Springs,CO,Triangle,"((HOAX?)) I saw a big triangle with 3 lights on each side, no light in the 
middle; similar to TR-3B, but w/o lights.((anonyous report))",38.8339578,-104.8253484,11/29/16,22:15
248,11/24/16 02:00,USA,Colorado Springs,CO,Light,"S sky, my wife and I were on the porch and we saw one bright star, that was 
moving. It was twinkling. ((NUFORC Note: Sirius. PD))",38.8339578,-104.8253484,11/24/16,02:00
452,11/10/2016 19:35,USA,Colorado Springs,CO,Light,Fast-moving light being chased by a helicopter.,38.8339578,-104.8253484,11/10/2016,19:35
516,11/06/2016 21:15,USA,Colorado Springs,CO,Triangle,"My son and I saw a large yellowish triangle object passing through the 
night sky at an incredible speed toward Pikes Peak Mountain. It",38.8339578,-104.8253484,11/06/2016,21:15
767,10/20/16 20:30,USA,Colorado Springs,CO,Other,"Four HUGE Lights Hovering Over Colorado Springs, CO Caught on Video",38.8339578,-104.8253484,10/20/16,20:30
806,10/18/16 19:00,USA,Colorado Springs,CO,Circle,"My two brothers and I observed a white orb hovering over (which seemed 
about 100's of feet above) Pikes Peak. It was stationary.",38.8339578,-104.8253484,10/18/16,19:00
832,10/17/16 01:36,USA,Colorado Springs,CO,Triangle,Bright white light triangular shape as if falling from sky,38.8339578,-104.8253484,10/17/16,01:36
1394,09/12/2016 01:00,USA,Colorado Springs,CO,Triangle,"I saw a triangle shape object with lights on the points and 1 light in the 
middle hovered in sky for 15-20 mins. ((anonymous report))",38.8339578,-104.8253484,09/12/2016,01:00
2103,08/01/2016 21:30,USA,Colorado Springs,CO,Other,5 colored lights moving in sky east to west.,38.8339578,-104.8253484,08/01/2016,21:30
2533,07/10/2016 13:00,USA,Colorado Springs,CO,Other,"It was a horseshoe shape and brown flyinging above the mountains 
disappearing and then coming back",38.8339578,-104.8253484,07/10/2016,13:00
2645,07/04/2016 21:12,USA,Colorado Springs,CO,Other,Green flashes seen above Colorado Springs.,38.8339578,-104.8253484,07/04/2016,21:12
2808,6/27/16 13:30,USA,Colorado Springs,CO,Sphere,White orb to the north west above pikes peak has not moved still visable.,38.8339578,-104.8253484,06/27/16,13:30
3482,05/02/2016 21:20,USA,Colorado Springs,CO,Other,Multiple Color UFO craft Happening Now.,38.8339578,-104.8253484,05/02/2016,21:20
3988,3/19/16 06:30,USA,Colorado Springs,CO,Other,"Thin light accompanied with 2 orange orbs,Colorado Springs, CO.",38.8339578,-104.8253484,03/19/16,06:30
4267,2/28/16 19:00,USA,Colorado Springs,CO,Circle,Read full report.,38.8339578,-104.8253484,02/28/16,19:00
4572,02/05/2016 20:35,USA,Colorado Springs,CO,Other,"Football-shaped saucer, red and gold over Colo Springs Feb 5 2016 8:35 pm 
mst.",38.8339578,-104.8253484,02/05/2016,20:35
4590,02/04/2016 23:00,USA,Colorado Springs,CO,Other,"Red fog in room, blueish chrome disk outside of front door, buzzing and pop 
noise, weird behavior from wife and dog.",38.8339578,-104.8253484,02/04/2016,23:00
4866,01/12/2016 14:00,USA,Colorado Springs,CO,Other,"Dark, elongated horizontal streak, which changed shape, seen by airline 
passengers over southern Colorado on January 12, 2016.",38.8339578,-104.8253484,01/12/2016,14:00
